{
  "schemaVersion": 1,
  "program": "conformant",
  "product": "Conformant",
  "version": "1.0.0",
  "contract": "agent-cli/v2",
  "cliApi": 1,
  "framework": "fixture",
  "kind": "catalog",
  "globalOptions": [
    {
      "long": "--format",
      "required": false,
      "repeatable": false,
      "summary": "Rendering.",
      "requires": [],
      "conflictsWith": [],
      "argument": {
        "name": "VALUE",
        "type": "choice",
        "choices": [
          "text",
          "json",
          "jsonl"
        ]
      },
      "default": "text"
    },
    {
      "long": "--json",
      "required": false,
      "repeatable": false,
      "summary": "Alias of --format json.",
      "requires": [],
      "conflictsWith": []
    },
    {
      "long": "--compact",
      "required": false,
      "repeatable": false,
      "summary": "One line.",
      "requires": [],
      "conflictsWith": []
    },
    {
      "long": "--pretty",
      "required": false,
      "repeatable": false,
      "summary": "Indent.",
      "requires": [],
      "conflictsWith": []
    },
    {
      "long": "--non-interactive",
      "required": false,
      "repeatable": false,
      "summary": "Never prompt.",
      "requires": [],
      "conflictsWith": []
    },
    {
      "long": "--verbose",
      "required": false,
      "repeatable": false,
      "summary": "Details of the run on stderr.",
      "requires": [],
      "conflictsWith": []
    },
    {
      "long": "--progress",
      "required": false,
      "repeatable": false,
      "summary": "Progress on stderr.",
      "requires": [],
      "conflictsWith": [],
      "argument": {
        "name": "VALUE",
        "type": "choice",
        "choices": [
          "auto",
          "always",
          "never"
        ]
      },
      "default": "auto"
    },
    {
      "long": "--pager",
      "required": false,
      "repeatable": false,
      "summary": "Pager on a terminal.",
      "requires": [],
      "conflictsWith": [],
      "argument": {
        "name": "VALUE",
        "type": "choice",
        "choices": [
          "auto",
          "always",
          "never"
        ]
      },
      "default": "auto"
    },
    {
      "long": "--color",
      "required": false,
      "repeatable": false,
      "summary": "Colors.",
      "requires": [],
      "conflictsWith": [],
      "argument": {
        "name": "VALUE",
        "type": "choice",
        "choices": [
          "auto",
          "always",
          "never"
        ]
      },
      "default": "auto"
    },
    {
      "long": "--field",
      "required": false,
      "repeatable": false,
      "summary": "Render one member of data.",
      "requires": [],
      "conflictsWith": [],
      "argument": {
        "name": "NAME",
        "type": "string"
      }
    },
    {
      "long": "--help",
      "required": false,
      "repeatable": false,
      "summary": "Help.",
      "requires": [],
      "conflictsWith": []
    },
    {
      "long": "--lang",
      "required": false,
      "repeatable": false,
      "summary": "Language of the human text.",
      "requires": [],
      "conflictsWith": [],
      "argument": {
        "name": "TAG",
        "type": "string",
        "pattern": "^[A-Za-z]{2,3}(-[A-Za-z]{4})?(-([A-Za-z]{2}|[0-9]{3}))?$"
      }
    }
  ],
  "invariants": [
    "one catalog"
  ],
  "output": {
    "contract": "agent-cli/v2",
    "schemaVersion": 2,
    "stdout": "success data only",
    "stderr": "diagnostics and failure envelopes"
  },
  "commands": [
    {
      "id": "help",
      "pattern": [
        "help"
      ],
      "usage": "help [COMMAND_ID] | --help",
      "purpose": "Help.",
      "effect": "read",
      "outputMode": "json-envelope",
      "external": false,
      "hidden": false,
      "available": true,
      "input": {
        "synopsis": "help [COMMAND_ID] | --help",
        "operands": [
          {
            "name": "COMMAND_ID",
            "required": false,
            "variadic": false,
            "summary": "Identifier."
          }
        ],
        "options": [],
        "constraints": [],
        "passthrough": false
      },
      "outputSchema": {
        "type": "object"
      },
      "exitCodes": {
        "0": "command completed",
        "1": "execution failed",
        "2": "valid report with violations"
      }
    },
    {
      "id": "version",
      "pattern": [
        "version"
      ],
      "usage": "version | --version",
      "purpose": "Identity.",
      "effect": "read",
      "outputMode": "json-envelope",
      "external": false,
      "hidden": false,
      "available": true,
      "input": {
        "synopsis": "version | --version",
        "operands": [],
        "options": [],
        "constraints": [],
        "passthrough": false
      },
      "outputSchema": {
        "type": "object"
      },
      "exitCodes": {
        "0": "command completed",
        "1": "execution failed",
        "2": "valid report with violations"
      }
    },
    {
      "id": "describe",
      "pattern": [
        "describe"
      ],
      "usage": "describe [COMMAND_ID] [--summary] [--prefix PREFIX]",
      "purpose": "Catalog.",
      "effect": "read",
      "outputMode": "json-envelope",
      "external": false,
      "hidden": false,
      "available": true,
      "input": {
        "synopsis": "describe [COMMAND_ID] [--summary] [--prefix PREFIX]",
        "operands": [
          {
            "name": "COMMAND_ID",
            "required": false,
            "variadic": false,
            "summary": "Identifier."
          }
        ],
        "options": [
          {
            "long": "--summary",
            "required": false,
            "repeatable": false,
            "summary": "Without schemas.",
            "requires": [],
            "conflictsWith": []
          },
          {
            "long": "--prefix",
            "required": false,
            "repeatable": false,
            "summary": "Select a command namespace.",
            "requires": [
              "--summary"
            ],
            "conflictsWith": [
              "COMMAND_ID"
            ],
            "argument": {
              "name": "PREFIX",
              "type": "string",
              "pattern": "^[a-z]([a-z0-9.-]*[a-z0-9-])?$"
            }
          },
          {
            "long": "--trace",
            "required": false,
            "repeatable": false,
            "summary": "Trace the catalog lookup.",
            "requires": [],
            "conflictsWith": [],
            "hidden": true
          }
        ],
        "constraints": [
          {
            "kind": "requires",
            "options": [
              "--prefix",
              "--summary"
            ]
          }
        ],
        "passthrough": false
      },
      "outputSchema": {
        "type": "object"
      },
      "exitCodes": {
        "0": "command completed",
        "1": "execution failed",
        "2": "valid report with violations"
      },
      "examples": [
        {
          "words": [
            "describe",
            "--summary",
            "--prefix",
            "note"
          ],
          "summary": "List the note commands."
        },
        {
          "words": [
            "describe",
            "note.write",
            "--format",
            "json"
          ],
          "summary": "Describe one command."
        }
      ]
    },
    {
      "id": "completion",
      "pattern": [
        "completion"
      ],
      "usage": "completion SHELL",
      "purpose": "Completion script.",
      "effect": "read",
      "outputMode": "json-envelope",
      "external": false,
      "hidden": false,
      "available": true,
      "input": {
        "synopsis": "completion SHELL",
        "operands": [
          {
            "name": "SHELL",
            "required": true,
            "variadic": false,
            "summary": "Shell.",
            "type": "choice",
            "choices": [
              "bash",
              "zsh",
              "fish"
            ]
          }
        ],
        "options": [],
        "constraints": [],
        "passthrough": false
      },
      "outputSchema": {
        "type": "object"
      },
      "exitCodes": {
        "0": "command completed",
        "1": "execution failed",
        "2": "valid report with violations"
      }
    },
    {
      "id": "complete.candidates",
      "pattern": [
        "__complete"
      ],
      "usage": "__complete -- WORDS...",
      "purpose": "Candidates.",
      "effect": "read",
      "outputMode": "json-records",
      "external": false,
      "hidden": true,
      "available": true,
      "input": {
        "synopsis": "__complete -- WORDS...",
        "operands": [
          {
            "name": "WORDS",
            "required": false,
            "variadic": true,
            "summary": "Words."
          }
        ],
        "options": [],
        "constraints": [],
        "passthrough": false
      },
      "outputSchema": {
        "type": "object"
      },
      "exitCodes": {
        "0": "command completed",
        "1": "execution failed",
        "2": "valid report with violations"
      }
    },
    {
      "id": "note.write",
      "pattern": [
        "note",
        "write"
      ],
      "usage": "note write FILE [--apply]",
      "purpose": "Store a note.",
      "effect": {
        "plan": "preview",
        "apply": "apply"
      },
      "outputMode": "json-envelope",
      "external": false,
      "hidden": false,
      "available": true,
      "input": {
        "synopsis": "note write FILE [--apply]",
        "operands": [
          {
            "name": "FILE",
            "required": true,
            "variadic": false,
            "summary": "File.",
            "type": "path"
          }
        ],
        "options": [
          {
            "long": "--apply",
            "required": false,
            "repeatable": false,